{
  "id": "74b72f6f-414a-3464-a4a2-d91397b4c439",
  "appealFlag": true,
  "applicantAppellantFlag": false,
  "boxworkNotifTemplate": "NOT_APPLICABLE",
  "breachType": "NOT_APPLICABLE",
  "categoryCode": "CO",
  "code": "MC80801",
  "commrOfOathFlag": false,
  "courtExtractAvlFlag": true,
  "courtOfAppealFlag": false,
  "hearingCode": "APN",
  "jurisdiction": "EITHER",
  "legislation": "Pursuant to Regulation 14 of the Criminal Legal Aid",
  "linkType": "LINKED",
  "listingNotifTemplate": "POSTAL_NOTIFICATION",
  "offenceActiveOrder": "NOT_APPLICABLE",
  "pleaApplicableFlag": false,
  "prosecutorThirdPartyFlag": false,
  "spiOutApplicableFlag": true,
  "summonsTemplateType": "NOT_APPLICABLE",
  "type": "Appeal against conviction and sentence by a Magistrates' Court to the Crown Court",
  "validFrom": "2022-01-01"
}
