{
  "id": "74b72f6f-414a-3464-a4a2-d91397b4c439",
  "type": "Appeal against conviction and sentence by a Magistrates' Court to the Crown Court",
  "code": "MC80801",
  "categoryCode": "CO",
  "linkType": "LINKED",
  "jurisdiction": "EITHER",
  "summonsTemplateType": "NOT_APPLICABLE",
  "breachType": "NOT_APPLICABLE",
  "appealFlag": false,
  "applicantAppellantFlag": false,
  "pleaApplicableFlag": false,
  "commrOfOathFlag": false,
  "courtOfAppealFlag": false,
  "courtExtractAvlFlag": true,
  "prosecutorThirdPartyFlag": false,
  "spiOutApplicableFlag": true,
  "offenceActiveOrder": "NOT_APPLICABLE"
}
